{
  "$schema": "./vehicle-catalogue.schema.json",
  "version": "1.0.0",
  "otherId": "other",
  "minModelYear": 1900,
  "maxModelYearOffset": 1,
  "manufacturers": [
    {
      "id": "volvo",
      "name": "Volvo",
      "common": true,
      "models": [
        { "id": "140", "name": "140" },
        { "id": "164", "name": "164" },
        { "id": "240", "name": "240" },
        { "id": "260", "name": "260" },
        { "id": "262c", "name": "262C" },
        { "id": "340", "name": "340" },
        { "id": "360", "name": "360" },
        { "id": "440", "name": "440" },
        { "id": "460", "name": "460" },
        { "id": "480", "name": "480" },
        { "id": "66", "name": "66" },
        { "id": "740", "name": "740" },
        { "id": "760", "name": "760" },
        { "id": "780", "name": "780" },
        { "id": "850", "name": "850" },
        { "id": "940", "name": "940" },
        { "id": "960", "name": "960" },
        { "id": "amazon", "name": "Amazon" },
        { "id": "c30", "name": "C30" },
        { "id": "c40", "name": "C40" },
        { "id": "c70", "name": "C70" },
        { "id": "ec40", "name": "EC40" },
        { "id": "em90", "name": "EM90" },
        { "id": "es90", "name": "ES90" },
        { "id": "ex30", "name": "EX30" },
        { "id": "ex40", "name": "EX40" },
        { "id": "ex90", "name": "EX90" },
        { "id": "p1800", "name": "P1800" },
        { "id": "pv444", "name": "PV444" },
        { "id": "pv544", "name": "PV544" },
        { "id": "s40", "name": "S40" },
        { "id": "s60", "name": "S60" },
        { "id": "s70", "name": "S70" },
        { "id": "s80", "name": "S80" },
        { "id": "s90", "name": "S90" },
        { "id": "v40", "name": "V40" },
        { "id": "v50", "name": "V50" },
        { "id": "v60", "name": "V60" },
        { "id": "v70", "name": "V70" },
        { "id": "v90", "name": "V90" },
        { "id": "xc40", "name": "XC40" },
        { "id": "xc60", "name": "XC60" },
        { "id": "xc70", "name": "XC70" },
        { "id": "xc90", "name": "XC90" }
      ]
    },
    {
      "id": "volkswagen",
      "name": "Volkswagen",
      "common": true,
      "models": [
        { "id": "amarok", "name": "Amarok" },
        { "id": "arteon", "name": "Arteon" },
        { "id": "beetle", "name": "Beetle" },
        { "id": "bora", "name": "Bora" },
        { "id": "caddy", "name": "Caddy" },
        { "id": "california", "name": "California" },
        { "id": "caravelle", "name": "Caravelle" },
        { "id": "corrado", "name": "Corrado" },
        { "id": "crafter", "name": "Crafter" },
        { "id": "e-golf", "name": "e-Golf" },
        { "id": "e-up", "name": "e-up!" },
        { "id": "eos", "name": "Eos" },
        { "id": "fox", "name": "Fox" },
        { "id": "golf", "name": "Golf" },
        { "id": "golf-plus", "name": "Golf Plus" },
        { "id": "golf-sportsvan", "name": "Golf Sportsvan" },
        { "id": "id-buzz", "name": "ID. Buzz" },
        { "id": "id-3", "name": "ID.3" },
        { "id": "id-4", "name": "ID.4" },
        { "id": "id-5", "name": "ID.5" },
        { "id": "id-7", "name": "ID.7" },
        { "id": "jetta", "name": "Jetta" },
        { "id": "karmann-ghia", "name": "Karmann Ghia" },
        { "id": "lupo", "name": "Lupo" },
        { "id": "multivan", "name": "Multivan" },
        { "id": "passat", "name": "Passat" },
        { "id": "phaeton", "name": "Phaeton" },
        { "id": "polo", "name": "Polo" },
        { "id": "scirocco", "name": "Scirocco" },
        { "id": "sharan", "name": "Sharan" },
        { "id": "t-cross", "name": "T-Cross" },
        { "id": "t-roc", "name": "T-Roc" },
        { "id": "taigo", "name": "Taigo" },
        { "id": "tiguan", "name": "Tiguan" },
        { "id": "touareg", "name": "Touareg" },
        { "id": "touran", "name": "Touran" },
        { "id": "transporter", "name": "Transporter" },
        { "id": "type-1", "name": "Type 1" },
        { "id": "type-2", "name": "Type 2" },
        { "id": "type-3", "name": "Type 3" },
        { "id": "up", "name": "Up!" },
        { "id": "vento", "name": "Vento" }
      ]
    },
    {
      "id": "toyota",
      "name": "Toyota",
      "common": true,
      "models": [
        { "id": "4runner", "name": "4Runner" },
        { "id": "auris", "name": "Auris" },
        { "id": "avensis", "name": "Avensis" },
        { "id": "aygo", "name": "Aygo" },
        { "id": "aygo-x", "name": "Aygo X" },
        { "id": "bz4x", "name": "bZ4X" },
        { "id": "c-hr", "name": "C-HR" },
        { "id": "camry", "name": "Camry" },
        { "id": "carina", "name": "Carina" },
        { "id": "celica", "name": "Celica" },
        { "id": "corolla", "name": "Corolla" },
        { "id": "corolla-cross", "name": "Corolla Cross" },
        { "id": "corolla-verso", "name": "Corolla Verso" },
        { "id": "crown", "name": "Crown" },
        { "id": "gr-supra", "name": "GR Supra" },
        { "id": "gr-yaris", "name": "GR Yaris" },
        { "id": "gr86", "name": "GR86" },
        { "id": "highlander", "name": "Highlander" },
        { "id": "hilux", "name": "Hilux" },
        { "id": "iq", "name": "iQ" },
        { "id": "land-cruiser", "name": "Land Cruiser" },
        { "id": "mr2", "name": "MR2" },
        { "id": "previa", "name": "Previa" },
        { "id": "prius", "name": "Prius" },
        { "id": "prius-plus", "name": "Prius+" },
        { "id": "proace", "name": "Proace" },
        { "id": "proace-city", "name": "Proace City" },
        { "id": "rav4", "name": "RAV4" },
        { "id": "starlet", "name": "Starlet" },
        { "id": "supra", "name": "Supra" },
        { "id": "tacoma", "name": "Tacoma" },
        { "id": "tercel", "name": "Tercel" },
        { "id": "tundra", "name": "Tundra" },
        { "id": "urban-cruiser", "name": "Urban Cruiser" },
        { "id": "verso", "name": "Verso" },
        { "id": "yaris", "name": "Yaris" },
        { "id": "yaris-cross", "name": "Yaris Cross" }
      ]
    },
    {
      "id": "bmw",
      "name": "BMW",
      "common": true,
      "models": [
        { "id": "02-serie", "name": "02-serie" },
        { "id": "1-serie", "name": "1-serie" },
        { "id": "2-serie", "name": "2-serie" },
        { "id": "2002", "name": "2002" },
        { "id": "3-serie", "name": "3-serie" },
        { "id": "3-0-cs", "name": "3.0 CS" },
        { "id": "4-serie", "name": "4-serie" },
        { "id": "5-serie", "name": "5-serie" },
        { "id": "6-serie", "name": "6-serie" },
        { "id": "7-serie", "name": "7-serie" },
        { "id": "8-serie", "name": "8-serie" },
        { "id": "i3", "name": "i3" },
        { "id": "i4", "name": "i4" },
        { "id": "i5", "name": "i5" },
        { "id": "i7", "name": "i7" },
        { "id": "ix", "name": "iX" },
        { "id": "ix1", "name": "iX1" },
        { "id": "ix2", "name": "iX2" },
        { "id": "ix3", "name": "iX3" },
        { "id": "m2", "name": "M2" },
        { "id": "m3", "name": "M3" },
        { "id": "m4", "name": "M4" },
        { "id": "m5", "name": "M5" },
        { "id": "m6", "name": "M6" },
        { "id": "m8", "name": "M8" },
        { "id": "x1", "name": "X1" },
        { "id": "x2", "name": "X2" },
        { "id": "x3", "name": "X3" },
        { "id": "x4", "name": "X4" },
        { "id": "x5", "name": "X5" },
        { "id": "x6", "name": "X6" },
        { "id": "x7", "name": "X7" },
        { "id": "xm", "name": "XM" },
        { "id": "z1", "name": "Z1" },
        { "id": "z3", "name": "Z3" },
        { "id": "z4", "name": "Z4" },
        { "id": "z8", "name": "Z8" }
      ]
    },
    {
      "id": "audi",
      "name": "Audi",
      "common": true,
      "models": [
        { "id": "100", "name": "100" },
        { "id": "200", "name": "200" },
        { "id": "50", "name": "50" },
        { "id": "80", "name": "80" },
        { "id": "90", "name": "90" },
        { "id": "a1", "name": "A1" },
        { "id": "a2", "name": "A2" },
        { "id": "a3", "name": "A3" },
        { "id": "a4", "name": "A4" },
        { "id": "a5", "name": "A5" },
        { "id": "a6", "name": "A6" },
        { "id": "a7", "name": "A7" },
        { "id": "a8", "name": "A8" },
        { "id": "cabriolet", "name": "Cabriolet" },
        { "id": "coupe", "name": "Coupé" },
        { "id": "e-tron-gt", "name": "e-tron GT" },
        { "id": "q2", "name": "Q2" },
        { "id": "q3", "name": "Q3" },
        { "id": "q4-e-tron", "name": "Q4 e-tron" },
        { "id": "q5", "name": "Q5" },
        { "id": "q6-e-tron", "name": "Q6 e-tron" },
        { "id": "q7", "name": "Q7" },
        { "id": "q8", "name": "Q8" },
        { "id": "q8-e-tron", "name": "Q8 e-tron" },
        { "id": "quattro", "name": "Quattro" },
        { "id": "r8", "name": "R8" },
        { "id": "rs-q3", "name": "RS Q3" },
        { "id": "rs-q8", "name": "RS Q8" },
        { "id": "rs3", "name": "RS3" },
        { "id": "rs4", "name": "RS4" },
        { "id": "rs5", "name": "RS5" },
        { "id": "rs6", "name": "RS6" },
        { "id": "rs7", "name": "RS7" },
        { "id": "tt", "name": "TT" },
        { "id": "v8", "name": "V8" }
      ]
    },
    {
      "id": "mercedes-benz",
      "name": "Mercedes-Benz",
      "common": true,
      "models": [
        { "id": "190", "name": "190" },
        { "id": "300sl", "name": "300SL" },
        { "id": "a-klass", "name": "A-Klass" },
        { "id": "amg-gt", "name": "AMG GT" },
        { "id": "b-klass", "name": "B-Klass" },
        { "id": "c-klass", "name": "C-Klass" },
        { "id": "citan", "name": "Citan" },
        { "id": "cl", "name": "CL" },
        { "id": "cla", "name": "CLA" },
        { "id": "clk", "name": "CLK" },
        { "id": "cls", "name": "CLS" },
        { "id": "e-klass", "name": "E-Klass" },
        { "id": "eqa", "name": "EQA" },
        { "id": "eqb", "name": "EQB" },
        { "id": "eqc", "name": "EQC" },
        { "id": "eqe", "name": "EQE" },
        { "id": "eqs", "name": "EQS" },